"ID";"Mercado";"Pilar de Contenido";"Tema";"Direccion Visual (Adobe/Envato/Freepik)";"Texto en Grafico (Hook)";"Copy de la Publicacion (Pie de foto/Script)";"Llamado a la Accion (CTA)"
"POST_01";"Honduras (HN)";"Branding & Identidad";"Logotipo Profesional vs. Logo Barato";"mockup de identidad corporativa en Envato Elements (papelería, tarjetas de presentación en tonos oscuros y bronce). Estilo minimalista y de lujo.";"Tu logotipo define el precio de tu trabajo... antes de que hables.";"¿Sabías que el 75% de las personas juzga la credibilidad de tu empresa solo por su diseño visual? Un logotipo de $10 te hará lucir como un negocio de $10. Si quieres cobrar tarifas premium, tu marca debe verse premium. En Moswen Designs creamos identidades visuales memorables alineadas con la visión de tu negocio. ¡Dile adiós a lo genérico!";"Chatea directamente con nuestro equipo aquí: http://wa.me/50493157191"
"POST_02";"Estados Unidos (USA)";"Fundamentos de Negocio";"Por qué el diseño hermoso falla sin un plan de negocio";"Fotografía minimalista en Freepik de una tienda moderna y lujosa en medio de un desierto vacío. Colores tierra, iluminación cinematográfica.";"A beautiful brand in the middle of nowhere is still... nowhere.";"Visual identity gets people to look; a business model gets them to pay. We don't just design stunning brands at Moswen Designs—we structure your business plan, pricing model, and customer acquisition channels. Build a brand that is beautiful on the outside and profitable on the inside. Let's build your growth engine.";"Schedule a free 15-minute diagnostic session here: https://moswen.odoo.com/book/fernando-elvir"
"POST_03";"Honduras (HN)";"Desarrollo Web & Apps";"¿Tu web es una tarjeta o un vendedor?";"Mockup en Adobe Suite de un teléfono móvil mostrando un dashboard oscuro e interactivo. De fondo, una tarjeta de presentación física tirada en el suelo.";"¿Tu página web vende o solo acumula polvo digital?";"Una página web no debe ser una tarjeta de presentación digital estática. Debe ser tu vendedor estrella las 24 horas del día. Diseñamos páginas ultra raíces que capturan leads y los conectan en tiempo real con tu CRM de Odoo. Si tu web no está generando prospectos automatizados, estás perdiendo dinero.";"Escríbenos hoy mismo por WhatsApp para auditar tu web: http://wa.me/50493157191"
"POST_04";"Estados Unidos (USA)";"Sistemas y Escalabilidad";"Plantillas estándar vs. Aplicaciones Web a medida";"Mockup en Envato Elements de un software SaaS moderno (interfaz de usuario oscura con gráficos en 3D de cristal y luces de neón).";"Tired of template limits holding your business back?";"Templates are fine when you're starting. But when you want to scale, you outgrow them. Standard platforms lock you into their features. We build bespoke web and mobile applications tailored to your business workflow, fully integrated with Odoo ERP. Don't force your business into a template. Build a system that fits your vision.";"Book a call with us to discuss your custom project: https://moswen.odoo.com/book/fernando-elvir"
"POST_05";"Honduras & USA";"Estrategia de Crecimiento";"La Escalera de Crecimiento de un Negocio";"Diseño en Adobe Suite/Freepik de una infografía en 3D (estilo glassmorphism) mostrando escalones iluminados: Branding -> Plan -> Web -> App -> CRM/ERP.";"El camino estratégico para escalar tu empresa.";"¿Sabes cuál es el error más común de los emprendedores? Crear una app sin tener un sitio web, o hacer publicidad sin tener una marca definida. El crecimiento sostenible sigue un orden: 1. Branding y Plan de Negocio (Cimientos), 2. Web y Redes (Visibilidad), y 3. Apps y Automatización (Escalabilidad). En Moswen Designs te acompañamos en cada escalón para que tu transición digital sea un éxito.";"Agenda tu cita o escríbenos para iniciar tu plan de crecimiento: https://moswen.odoo.com/book/fernando-elvir o http://wa.me/50493157191"